{
  "schemaVersion": 1,
  "season": "2026/27",
  "clubId": "burnley",
  "snapshot": "2026-09-11",
  "sourceSummary": "Burnley 2026/27 post-window squad and role cross-check using FootballSquads and current FBref/club roster evidence, with Transfermarkt current or latest published market values. Where a valuation page still reflects the player's previous club, Burnley roster evidence is kept separate and explicit rather than treating the older club label as current-squad proof.",
  "players": {
    "Max Weiss": {"age":22,"marketValueM":4,"position":0,"sources":["https://www.footballsquads.co.uk/eng/2026-2027/flcham/burnley.htm","https://fbref.com/en/squads/943e8050/2026-2027/Burnley-Stats","https://www.transfermarkt.com/max-weiss/profil/spieler/521494"],"notes":"ASCII football name retained to match the published SWOS Studio identity record for Max Weiß."},
    "Gregoire Coudert": {"age":27,"marketValueM":4,"position":0,"sources":["https://www.footballsquads.co.uk/eng/2026-2027/flcham/burnley.htm","https://www.transfermarkt.com/gregoire-coudert/profil/spieler/527979"],"notes":"ASCII football name retained for Grégoire Coudert. FootballSquads supplies current Burnley roster truth; valuation uses the latest published Transfermarkt value."},
    "Kyle Walker": {"age":36,"marketValueM":1.5,"position":1,"sources":["https://www.footballsquads.co.uk/eng/2026-2027/flcham/burnley.htm","https://fbref.com/en/squads/943e8050/2026-2027/Burnley-Stats","https://www.transfermarkt.com/kyle-walker/profil/spieler/95424"]},
    "Max Alleyne": {"age":21,"marketValueM":8,"position":3,"sources":["https://www.footballsquads.co.uk/eng/2026-2027/flcham/burnley.htm","https://fbref.com/en/squads/943e8050/2026-2027/Burnley-Stats","https://www.transfermarkt.com/max-alleyne/profil/spieler/865516"],"notes":"Age is calculated from 21 July 2005 at the 11 September 2026 snapshot. Current Burnley roster evidence is separate from the latest published valuation record."},
    "Bashir Humphreys": {"age":23,"marketValueM":12,"position":3,"sources":["https://www.footballsquads.co.uk/eng/2026-2027/flcham/burnley.htm","https://fbref.com/en/squads/943e8050/2026-2027/Burnley-Stats","https://www.transfermarkt.com/bashir-humphreys/profil/spieler/682770"]},
    "Igor": {"age":28,"marketValueM":10,"position":3,"sources":["https://www.footballsquads.co.uk/eng/2026-2027/flcham/burnley.htm","https://fbref.com/en/squads/943e8050/2026-2027/Burnley-Stats","https://www.transfermarkt.com/igor/profil/spieler/380350"],"notes":"Current Burnley roster evidence is separate from the latest published valuation record, which may still reflect a prior club."},
    "Reo Hatate": {"age":28,"marketValueM":10,"position":6,"sources":["https://www.footballsquads.co.uk/eng/2026-2027/flcham/burnley.htm","https://fbref.com/en/squads/943e8050/2026-2027/Burnley-Stats","https://www.transfermarkt.com/reo-hatate/profil/spieler/504671"],"notes":"Current Burnley roster evidence is separate from the latest published valuation record, which may still reflect Celtic."},
    "Ugo Raghouber": {"age":23,"marketValueM":3,"position":6,"sources":["https://www.footballsquads.co.uk/eng/2026-2027/flcham/burnley.htm","https://fbref.com/en/squads/943e8050/2026-2027/Burnley-Stats","https://www.transfermarkt.com/ugo-raghouber/profil/spieler/743592"],"notes":"Current Burnley roster evidence is separate from the latest published valuation record, which may still reflect Lille."},
    "Hannibal Mejbri": {"age":23,"marketValueM":15,"position":6,"sources":["https://www.footballsquads.co.uk/eng/2026-2027/flcham/burnley.htm","https://fbref.com/en/squads/943e8050/2026-2027/Burnley-Stats","https://www.transfermarkt.com/hannibal-mejbri/profil/spieler/607224"]},
    "Josh Laurent": {"age":31,"marketValueM":1.5,"position":6,"sources":["https://www.footballsquads.co.uk/eng/2026-2027/flcham/burnley.htm","https://fbref.com/en/squads/943e8050/2026-2027/Burnley-Stats","https://www.transfermarkt.com/josh-laurent/profil/spieler/335268"]},
    "Mike Tresor": {"age":27,"marketValueM":2,"position":6,"sources":["https://www.footballsquads.co.uk/eng/2026-2027/flcham/burnley.htm","https://fbref.com/en/squads/943e8050/2026-2027/Burnley-Stats","https://www.transfermarkt.com/mike-tresor/profil/spieler/409966"],"notes":"ASCII football name retained to match the published SWOS Studio identity record for Mike Trésor."},
    "Jacob Bruun Larsen": {"age":27,"marketValueM":4,"position":5,"sources":["https://www.footballsquads.co.uk/eng/2026-2027/flcham/burnley.htm","https://fbref.com/en/squads/943e8050/2026-2027/Burnley-Stats","https://www.transfermarkt.com/jacob-bruun-larsen/profil/spieler/293281"],"notes":"Left-sided attacking role mapped to SWOS LW/LM code 5."},
    "Marcus Edwards": {"age":27,"marketValueM":6,"position":4,"sources":["https://www.footballsquads.co.uk/eng/2026-2027/flcham/burnley.htm","https://fbref.com/en/squads/943e8050/2026-2027/Burnley-Stats","https://www.transfermarkt.com/marcus-edwards/profil/spieler/314390"],"notes":"Right-sided attacking role mapped to SWOS RW/RM code 4."},
    "Zeki Amdouni": {"age":25,"marketValueM":7,"position":7,"sources":["https://www.footballsquads.co.uk/eng/2026-2027/flcham/burnley.htm","https://fbref.com/en/squads/943e8050/2026-2027/Burnley-Stats","https://www.transfermarkt.com/zeki-amdouni/profil/spieler/548729"]},
    "Armando Broja": {"age":25,"marketValueM":5,"position":7,"sources":["https://www.footballsquads.co.uk/eng/2026-2027/flcham/burnley.htm","https://fbref.com/en/squads/943e8050/2026-2027/Burnley-Stats","https://www.transfermarkt.com/armando-broja/profil/spieler/571743"],"notes":"Age is 25 at the 11 September 2026 snapshot (born 10 September 2001)."},
    "Jaydon Banel": {"age":21,"marketValueM":1,"position":5,"sources":["https://www.footballsquads.co.uk/eng/2026-2027/flcham/burnley.htm","https://fbref.com/en/squads/943e8050/2026-2027/Burnley-Stats","https://www.transfermarkt.com/jaydon-banel/profil/spieler/682790"],"notes":"Left-sided attacking role mapped to SWOS LW/LM code 5."}
  }
}
