{
  "schemaVersion": 1,
  "season": "2026/27",
  "clubId": "wrexham",
  "snapshot": "2026-09-27",
  "sourceSummary": "Wrexham 2026/27 current Championship squad and market-value cross-check using a live current squad/value feed. All 16 selected identities remain current at the 27 September 2026 snapshot, so no roster correction is required.",
  "players": {
    "Danny Ward": {
      "age": 33,
      "marketValueM": 0.6,
      "position": 0,
      "sources": [
        "https://matchchase.com/team/wrexham/squad"
      ],
      "notes": "Current Wrexham goalkeeper; maps to SWOS GK code 0. Current published valuation €0.6m."
    },
    "Anthony Patterson": {
      "age": 26,
      "marketValueM": 8,
      "position": 0,
      "sources": [
        "https://matchchase.com/team/wrexham/squad"
      ],
      "notes": "Current Wrexham goalkeeper; maps to SWOS GK code 0. Current published valuation €8m."
    },
    "Callum Doyle": {
      "age": 22,
      "marketValueM": 12,
      "position": 3,
      "sources": [
        "https://matchchase.com/team/wrexham/squad"
      ],
      "notes": "Centre-back maps to SWOS defender code 3. Current published valuation €12m."
    },
    "Jacques Ekomie": {
      "age": 23,
      "marketValueM": 9,
      "position": 2,
      "sources": [
        "https://matchchase.com/team/wrexham/squad"
      ],
      "notes": "ASCII identity name retained for Jacques Ekomié. Primary left-back maps to SWOS LB code 2. Current published valuation €9m."
    },
    "Max Cleworth": {
      "age": 24,
      "marketValueM": 10,
      "position": 3,
      "sources": [
        "https://matchchase.com/team/wrexham/squad"
      ],
      "notes": "Centre-back maps to SWOS defender code 3. Current published valuation €10m."
    },
    "Dominic Hyam": {
      "age": 30,
      "marketValueM": 2,
      "position": 3,
      "sources": [
        "https://matchchase.com/team/wrexham/squad"
      ],
      "notes": "Centre-back maps to SWOS defender code 3. Current published valuation €2m."
    },
    "Joe Worrall": {
      "age": 29,
      "marketValueM": 2,
      "position": 3,
      "sources": [
        "https://matchchase.com/team/wrexham/squad"
      ],
      "notes": "Current Wrexham centre-back after his September 2026 arrival. Maps to SWOS defender code 3. Current published valuation €2m."
    },
    "Issa Kabore": {
      "age": 25,
      "marketValueM": 4,
      "position": 1,
      "sources": [
        "https://matchchase.com/team/wrexham/squad"
      ],
      "notes": "ASCII identity name retained for Issa Kaboré. Primary right-back maps to SWOS RB code 1. Current published valuation €4m."
    },
    "Ben Whiteman": {
      "age": 30,
      "marketValueM": 2,
      "position": 6,
      "sources": [
        "https://matchchase.com/team/wrexham/squad"
      ],
      "notes": "Central midfield maps to SWOS code 6. Current published valuation €2m."
    },
    "Josh Windass": {
      "age": 32,
      "marketValueM": 1,
      "position": 6,
      "sources": [
        "https://matchchase.com/team/wrexham/squad"
      ],
      "notes": "Attacking midfield maps to SWOS midfield code 6. Current published valuation €1m."
    },
    "George Thomason": {
      "age": 25,
      "marketValueM": 2.5,
      "position": 6,
      "sources": [
        "https://matchchase.com/team/wrexham/squad"
      ],
      "notes": "Central midfield maps to SWOS code 6. Current published valuation €2.5m."
    },
    "George Dobson": {
      "age": 28,
      "marketValueM": 1.5,
      "position": 6,
      "sources": [
        "https://matchchase.com/team/wrexham/squad",
        "https://xgstats.com/players/632548/george-dobson"
      ],
      "notes": "Defensive midfield maps to SWOS code 6. Current published valuation €1.5m."
    },
    "Callum O'Hare": {
      "age": 28,
      "marketValueM": 5,
      "position": 6,
      "sources": [
        "https://matchchase.com/team/wrexham/squad"
      ],
      "notes": "Attacking midfield maps to SWOS midfield code 6. Current published valuation €5m."
    },
    "Bailey-Tye Cadamarteri": {
      "age": 21,
      "marketValueM": 2,
      "position": 7,
      "sources": [
        "https://matchchase.com/team/wrexham/squad"
      ],
      "notes": "Centre-forward maps to SWOS attack code 7. Current published valuation €2m."
    },
    "Kieffer Moore": {
      "age": 34,
      "marketValueM": 1.3,
      "position": 7,
      "sources": [
        "https://matchchase.com/team/wrexham/squad"
      ],
      "notes": "Centre-forward maps to SWOS attack code 7. Current published valuation €1.3m."
    },
    "Sam Smith": {
      "age": 28,
      "marketValueM": 1.2,
      "position": 7,
      "sources": [
        "https://matchchase.com/team/wrexham/squad"
      ],
      "notes": "Centre-forward maps to SWOS attack code 7. Current published valuation €1.2m."
    }
  }
}
