{
  "schemaVersion": 1,
  "season": "2026/27",
  "clubId": "preston-north-end",
  "snapshot": "2026-09-11",
  "sourceSummary": "Preston North End 2026/27 post-window roster cross-check using FootballSquads and current transfer records, with latest published Transfermarkt market values. Snapshot ages are recalculated to 11 September 2026 where valuation pages predate summer birthdays. Stanley Mills and Liam Gibbs are treated as current Preston players using post-window transfer evidence even where older valuation profiles still show their former/parent clubs.",
  "players": {
    "Daniel Iversen": {"age":29,"marketValueM":2.5,"position":0,"sources":["https://footballsquads.co.uk/eng/2026-2027/flcham/preston.htm","https://www.transfermarkt.com/preston-north-end/kader/verein/466/saison_id/2026"],"notes":"DOB 19 July 1997 gives age 29 at the snapshot. Goalkeeper maps to SWOS code 0; latest published valuation €2.5m."},
    "Lee Nicholls": {"age":33,"marketValueM":0.4,"position":0,"sources":["https://footballsquads.co.uk/eng/2026-2027/flcham/preston.htm","https://www.transfermarkt.com/preston-north-end/kader/verein/466/saison_id/2026/plus/1"],"notes":"Goalkeeper maps to SWOS code 0; latest published valuation €0.4m."},
    "Pol Valentin": {"age":29,"marketValueM":0.6,"position":1,"sources":["https://footballsquads.co.uk/eng/2026-2027/flcham/preston.htm","https://www.transfermarkt.com/pol-valentin/marktwertverlauf/spieler/380737"],"notes":"ASCII football name matches Pol Valentín. Primary right-back role maps to SWOS RB code 1; latest published valuation €0.6m."},
    "Andrija Vukcevic": {"age":29,"marketValueM":0.5,"position":2,"sources":["https://footballsquads.co.uk/eng/2026-2027/flcham/preston.htm","https://www.transfermarkt.co.uk/andrija-vukcevic/profil/spieler/294987"],"notes":"ASCII football name matches Andrija Vukčević. Primary left-back role maps to SWOS LB code 2; latest published valuation €0.5m."},
    "Harry Clarke": {"age":25,"marketValueM":2.5,"position":1,"sources":["https://footballsquads.co.uk/eng/2026-2027/flcham/preston.htm","https://www.soccerbase.com/teams/team.sd?teamTabs=transfers&team_id=2054","https://www.transfermarkt.co.uk/harry-clarke/profil/spieler/528892"],"notes":"Current transfer records show Clarke joined Preston in August 2026; the latest published Transfermarkt valuation €2.5m predates that move. Primary right-back role maps to SWOS RB code 1."},
    "Liam Lindsay": {"age":30,"marketValueM":1,"position":3,"sources":["https://footballsquads.co.uk/eng/2026-2027/flcham/preston.htm","https://www.transfermarkt.co.uk/liam-lindsay/profil/spieler/228912"],"notes":"Centre-back maps to SWOS defender code 3; latest published valuation €1.0m."},
    "Jordan Storey": {"age":29,"marketValueM":4.5,"position":3,"sources":["https://footballsquads.co.uk/eng/2026-2027/flcham/preston.htm","https://www.transfermarkt.com/preston-north-end/kader/verein/466/saison_id/2026/plus/1"],"notes":"DOB 2 September 1997 gives age 29 at the snapshot. Centre-back maps to SWOS defender code 3; latest published valuation €4.5m."},
    "Alfie Devine": {"age":22,"marketValueM":8,"position":6,"sources":["https://footballsquads.co.uk/eng/2026-2027/flcham/preston.htm","https://www.tottenhamhotspur.com/news/1076787/preston-switch-for-alfie","https://www.transfermarkt.co.uk/alfie-devine/profil/spieler/728734"],"notes":"DOB 1 August 2004 gives age 22 at the snapshot. Tottenham confirms the July 2026 permanent transfer. Attacking/central midfield maps to SWOS midfield code 6; latest published valuation €8m."},
    "Ali McCann": {"age":26,"marketValueM":2.2,"position":6,"sources":["https://footballsquads.co.uk/eng/2026-2027/flcham/preston.htm","https://www.transfermarkt.com/ali-mccann/profil/spieler/450714"],"notes":"Central midfield maps to SWOS code 6; latest published valuation €2.2m."},
    "Thierry Small": {"age":22,"marketValueM":7,"position":2,"sources":["https://footballsquads.co.uk/eng/2026-2027/flcham/preston.htm","https://www.transfermarkt.co.uk/thierry-small/profil/spieler/746554"],"notes":"DOB 1 August 2004 gives age 22 at the snapshot. Although staged broadly as a midfielder, his primary current role is left-back, mapped to SWOS LB code 2. Latest published valuation €7m."},
    "Jordan Thompson": {"age":29,"marketValueM":0.7,"position":6,"sources":["https://footballsquads.co.uk/eng/2026-2027/flcham/preston.htm","https://www.transfermarkt.co.uk/jordan-thompson/profil/spieler/321169"],"notes":"Central midfield maps to SWOS code 6; latest published valuation €0.7m."},
    "Liam Gibbs": {"age":23,"marketValueM":1.5,"position":6,"sources":["https://footballsquads.co.uk/eng/2026-2027/flcham/preston.htm","https://www.soccerbase.com/teams/team.sd?teamTabs=transfers&team_id=2054","https://www.transfermarkt.co.uk/liam-gibbs/profil/spieler/724785"],"notes":"Post-window transfer records show the 1 September 2026 Preston loan from Norwich; older valuation profile still shows Norwich ownership. Central midfield maps to SWOS code 6; latest published valuation €1.5m."},
    "Andy Moran": {"age":22,"marketValueM":1.5,"position":6,"sources":["https://footballsquads.co.uk/eng/2026-2027/flcham/preston.htm","https://www.transfermarkt.co.uk/andrew-moran/profil/spieler/724537"],"notes":"Identity uses Andy Moran while Transfermarkt renders Andrew Moran. Attacking/central midfield maps to SWOS code 6; latest published valuation €1.5m."},
    "Jusef Erabi": {"age":23,"marketValueM":2,"position":7,"sources":["https://footballsquads.co.uk/eng/2026-2027/flcham/preston.htm","https://www.transfermarkt.com/jusef-erabi/profil/spieler/851699"],"notes":"Current Preston loan from Genk. Centre-forward maps to SWOS attack code 7; latest published valuation €2m."},
    "Callum Lang": {"age":28,"marketValueM":2.5,"position":4,"sources":["https://footballsquads.co.uk/eng/2026-2027/flcham/preston.htm","https://www.bbc.co.uk/sport/football/articles/cly3810gprzo","https://www.transfermarkt.com/callum-lang/profil/spieler/425865"],"notes":"DOB 8 September 1998 gives age 28 at the snapshot. Primary right-wing role maps to SWOS RW/RM code 4; latest published valuation €2.5m."},
    "Stanley Mills": {"age":22,"marketValueM":1,"position":4,"sources":["https://footballsquads.co.uk/eng/2026-2027/flcham/preston.htm","https://www.soccerbase.com/teams/team.sd?teamTabs=transfers&team_id=2054","https://www.transfermarkt.com/stanley-mills/transfers/spieler/801005"],"notes":"Post-window transfer records show Mills joining Preston on 27 August 2026; an earlier August report had anticipated a January move before circumstances changed. Latest published valuation €1m comes from his Oxford registration. Primary right-wing role maps to SWOS RW/RM code 4."}
  }
}
