{
  "schemaVersion": 1,
  "season": "2026/27",
  "clubId": "middlesbrough",
  "snapshot": "2026-09-11",
  "sourceSummary": "Middlesbrough 2026/27 post-window roster cross-check using FootballSquads and current club/parent-club confirmation, with Transfermarkt latest published valuations. Three stale identities are corrected before research publication: Seny Dieng, Finley Munroe and Morgan Whittaker are replaced by current-role equivalents Radek Vitek, Ashley Phillips and Amario Cozier-Duberry.",
  "players": {
    "Radek Vitek": {"age":22,"marketValueM":6,"position":0,"sources":["https://footballsquads.co.uk/eng/2026-2027/flcham/middles.htm","https://www.transfermarkt.com/radek-vitek/marktwertverlauf/spieler/622236"],"notes":"ASCII football name retained to match the corrected identity record for Radek Vítek. FootballSquads supplies current Middlesbrough roster truth; €6m is the latest published Transfermarkt valuation."},
    "Sol Brynn": {"age":25,"marketValueM":9,"position":0,"sources":["https://footballsquads.co.uk/eng/2026-2027/flcham/middles.htm","https://www.transfermarkt.co.uk/fc-middlesbrough/kader/verein/641/saison_id/2026"]},
    "Callum Brittain": {"age":28,"marketValueM":7,"position":1,"sources":["https://footballsquads.co.uk/eng/2026-2027/flcham/middles.htm","https://www.transfermarkt.com/callum-brittain/marktwertverlauf/spieler/416368"]},
    "Alfie Jones": {"age":28,"marketValueM":6,"position":3,"sources":["https://footballsquads.co.uk/eng/2026-2027/flcham/middles.htm","https://www.transfermarkt.co.uk/alfie-jones/profil/spieler/340990"]},
    "Luke Ayling": {"age":35,"marketValueM":0.35,"position":1,"sources":["https://footballsquads.co.uk/eng/2026-2027/flcham/middles.htm","https://www.transfermarkt.co.uk/fc-middlesbrough/marktwertanalyse/verein/641/1000"]},
    "Ashley Phillips": {"age":21,"marketValueM":7,"position":3,"sources":["https://footballsquads.co.uk/eng/2026-2027/flcham/middles.htm","https://www.tottenhamhotspur.com/news/1085616/phillips-joins-middlesbrough","https://www.transfermarkt.co.uk/ashley-phillips/marktwertverlauf/spieler/859951"],"notes":"Tottenham confirms the permanent 15 August 2026 Middlesbrough transfer; €7m is the latest published Transfermarkt valuation."},
    "Max Arfsten": {"age":25,"marketValueM":5,"position":2,"sources":["https://footballsquads.co.uk/eng/2026-2027/flcham/middles.htm","https://www.ussoccer.com/players/a/max-arfsten","https://www.transfermarkt.com/max-arfsten/profil/spieler/993063"],"notes":"Current Middlesbrough usage is left-back/left wing-back; mapped to SWOS LB code 2. €5m is the latest published Transfermarkt valuation from before the August transfer."},
    "Sebastian Berhalter": {"age":25,"marketValueM":8,"position":6,"sources":["https://footballsquads.co.uk/eng/2026-2027/flcham/middles.htm","https://www.transfermarkt.co.uk/sebastian-berhalter/profil/spieler/734761"],"notes":"FootballSquads supplies current Middlesbrough roster truth; €8m is the latest published Transfermarkt valuation from his Vancouver period. Central/defensive midfield maps to SWOS code 6."},
    "Riley McGree": {"age":27,"marketValueM":3.5,"position":6,"sources":["https://footballsquads.co.uk/eng/2026-2027/flcham/middles.htm","https://www.transfermarkt.co.uk/fc-middlesbrough/marktwertanalyse/verein/641/1000"]},
    "Aidan Morris": {"age":24,"marketValueM":10,"position":6,"sources":["https://footballsquads.co.uk/eng/2026-2027/flcham/middles.htm","https://www.transfermarkt.co.uk/fc-middlesbrough/marktwertanalyse/verein/641/1000"]},
    "Myles Peart-Harris": {"age":23,"marketValueM":0.9,"position":6,"sources":["https://footballsquads.co.uk/eng/2026-2027/flcham/middles.htm","https://www.transfermarkt.co.uk/myles-peart-harris/profil/spieler/587002"],"notes":"Attacking midfield maps to SWOS midfield code 6."},
    "Jeremy Sarmiento": {"age":24,"marketValueM":5,"position":5,"sources":["https://footballsquads.co.uk/eng/2026-2027/flcham/middles.htm","https://www.transfermarkt.co.uk/jeremy-sarmiento/profil/spieler/568005"],"notes":"Primary left-wing role maps to SWOS LW/LM code 5."},
    "Will Lankshear": {"age":21,"marketValueM":7,"position":7,"sources":["https://footballsquads.co.uk/eng/2026-2027/flcham/middles.htm","https://www.transfermarkt.com/will-lankshear/profil/spieler/879768"],"notes":"FootballSquads supplies current Middlesbrough roster truth; €7m is the latest published Transfermarkt valuation from his Tottenham registration. Centre-forward maps to SWOS attack code 7."},
    "Tommy Conway": {"age":24,"marketValueM":14,"position":7,"sources":["https://footballsquads.co.uk/eng/2026-2027/flcham/middles.htm","https://www.transfermarkt.com/tommy-conway/transfers/spieler/801426"]},
    "Amario Cozier-Duberry": {"age":21,"marketValueM":5,"position":4,"sources":["https://footballsquads.co.uk/eng/2026-2027/flcham/middles.htm","https://www.brightonandhovealbion.com/media-article/mft-transfer-news-amario-cozier-duberry-millwall-september-2026","https://www.transfermarkt.co.uk/amario-cozier-duberry/marktwertverlauf/spieler/878150"],"notes":"Brighton confirms the 1 September 2026 season-long Middlesbrough loan. Primary right-wing role maps to SWOS RW/RM code 4; €5m is the latest published Transfermarkt valuation."},
    "David Strelec": {"age":25,"marketValueM":8,"position":7,"sources":["https://footballsquads.co.uk/eng/2026-2027/flcham/middles.htm","https://www.transfermarkt.co.uk/david-strelec/profil/spieler/482836"]}
  }
}
