{
  "schemaVersion": 1,
  "season": "2026/27",
  "clubId": "derby-county",
  "snapshot": "2026-09-11",
  "sourceSummary": "Derby County 2026/27 current squad and role cross-check using Derby County official first-team/squad-number pages and FootballSquads, with current/latest published Transfermarkt valuations. Where a player changed clubs during the summer window, current Derby roster evidence is kept separate from the latest valuation source.",
  "players": {
    "Jacob Widell Zetterstrom": {"age":28,"marketValueM":2.5,"position":0,"sources":["https://www.dcfc.co.uk/teams/1st-team","https://footballsquads.co.uk/eng/2026-2027/flcham/derby.htm","Transfermarkt Derby County 2026/27 market values"],"notes":"ASCII football name retained to match the published SWOS Studio identity record for Jacob Widell Zetterström."},
    "Richard O'Donnell": {"age":37,"marketValueM":0.05,"position":0,"sources":["https://www.dcfc.co.uk/teams/1st-team","https://footballsquads.co.uk/eng/2026-2027/flcham/derby.htm","Transfermarkt Derby County 2026/27 market values"]},
    "Derry John Murkin": {"age":27,"marketValueM":1.5,"position":2,"sources":["https://www.dcfc.co.uk/teams/1st-team","https://footballsquads.co.uk/eng/2026-2027/flcham/derby.htm","Transfermarkt Derby County 2026/27 market values"]},
    "Craig Forsyth": {"age":37,"marketValueM":0.05,"position":2,"sources":["https://www.dcfc.co.uk/teams/1st-team","https://footballsquads.co.uk/eng/2026-2027/flcham/derby.htm","Transfermarkt Derby County 2026/27 market values"]},
    "Matthew Clarke": {"age":29,"marketValueM":2,"position":3,"sources":["https://www.dcfc.co.uk/teams/1st-team","https://footballsquads.co.uk/eng/2026-2027/flcham/derby.htm","Transfermarkt Derby County 2026/27 market values"],"notes":"Official Derby site displays Matt Clarke; published SWOS Studio identity name remains Matthew Clarke."},
    "Sondre Langas": {"age":25,"marketValueM":4,"position":3,"sources":["https://www.dcfc.co.uk/teams/1st-team","https://footballsquads.co.uk/eng/2026-2027/flcham/derby.htm","Transfermarkt Derby County 2026/27 market values"],"notes":"ASCII football name retained to match the published SWOS Studio identity record for Sondre Langås."},
    "Charlie Taylor": {"age":32,"marketValueM":1.2,"position":2,"sources":["https://www.dcfc.co.uk/news/2026/08/squad-news-squad-numbers-for-202627-season-confirmed","https://footballsquads.co.uk/eng/2026-2027/flcham/derby.htm","Transfermarkt latest published Charlie Taylor market value"]},
    "David Ozoh": {"age":21,"marketValueM":2.2,"position":6,"sources":["https://www.dcfc.co.uk/teams/player/david-ozoh","https://www.dcfc.co.uk/teams/1st-team","Transfermarkt latest published David Ozoh market value"],"notes":"Derby official profile confirms his permanent September 2026 move and defensive-midfield role."},
    "Bobby Clark": {"age":21,"marketValueM":8,"position":6,"sources":["https://www.dcfc.co.uk/news/2026/08/squad-news-squad-numbers-for-202627-season-confirmed","https://www.dcfc.co.uk/teams/1st-team","Transfermarkt Derby County 2026/27 market values"]},
    "Sammie Szmodics": {"age":30,"marketValueM":3.5,"position":6,"sources":["https://www.dcfc.co.uk/news/2026/08/squad-news-squad-numbers-for-202627-season-confirmed","https://www.dcfc.co.uk/teams/1st-team","Transfermarkt latest published Sammie Szmodics market value"],"notes":"Attacking midfield/forward role is represented by SWOS midfield code 6 for this selected pack."},
    "Kenzo Goudmijn": {"age":24,"marketValueM":0.7,"position":6,"sources":["https://www.dcfc.co.uk/teams/1st-team","https://footballsquads.co.uk/eng/2026-2027/flcham/derby.htm","Transfermarkt Derby County 2026/27 market values"]},
    "Alex Mowatt": {"age":31,"marketValueM":1,"position":6,"sources":["https://www.dcfc.co.uk/teams/player/alex-mowatt","https://www.dcfc.co.uk/news/2026/08/transfer-news-introducingalex-mowatt","FootballTransfers Alex Mowatt ETV updated September 2026"],"notes":"Current September 2026 ETV is used after his August move to Derby; official Derby evidence supplies current-club and midfield-role truth."},
    "Patrick Agyemang": {"age":25,"marketValueM":10,"position":7,"sources":["https://www.dcfc.co.uk/teams/1st-team","https://footballsquads.co.uk/eng/2026-2027/flcham/derby.htm","Transfermarkt Derby County 2026/27 market values"]},
    "Carlton Morris": {"age":30,"marketValueM":4.5,"position":7,"sources":["https://www.dcfc.co.uk/teams/1st-team","https://footballsquads.co.uk/eng/2026-2027/flcham/derby.htm","Transfermarkt Derby County 2026/27 market values"]},
    "Rhian Brewster": {"age":26,"marketValueM":2.5,"position":7,"sources":["https://www.dcfc.co.uk/teams/1st-team","https://footballsquads.co.uk/eng/2026-2027/flcham/derby.htm","Transfermarkt Derby County 2026/27 market values"]},
    "Filip Bilbija": {"age":26,"marketValueM":3,"position":5,"sources":["https://www.dcfc.co.uk/teams/player/filip-bilbija","https://www.dcfc.co.uk/news/2026/08/squad-news-squad-numbers-for-202627-season-confirmed","Transfermarkt latest published Filip Bilbija market value"],"notes":"Derby official profile describes a versatile attacking midfielder; latest Transfermarkt role is left-sided attacker, mapped to SWOS LW/LM code 5. Current Derby roster evidence is separate from the latest pre-transfer valuation record."}
  }
}
